Orez slefuit cu bobul rotund Bunetto,330,7,1,71.8,0
Orez Sunshine Jasmine,248,8,0,77,0
Orez thai rosu bob lung Natura Land,360,7,1.5,79,2
Ovaz desert Dr. Oetker,123,4.2,3.6,18,1.2
Paine crocanta cu susan si amarant Allos,362,11.5,7.5,61.3,12.5
Paine cu faina integrala Vita Star,245,11.3,2.3,47.5,5.8
Paine dietetica aparat Moulinex,234,7,3,42,1
Paine extrudata Profi,380,11,2.2,78,0
Paine integrala secara cu amestec cereale Mestemacher,197,6.2,4.7,32.4,8.4
Paine Moulinex Oct,365,11.7,5,66,11
Paine prajita clasic Eti Mek,401,10.2,4.4,78.4,5
Paine prajita integrala Dia,365,12.6,6.6,63.8,6
Paine prajita Light Form Eti,358,19.3,1.4,70.2,0
Paine toast KornFit Savoria,243,9.6,6.8,35.6,8.6
Paine toast Panzucca Savoria,286,7.5,3.8,55.5,3.7
Panite branza Nutrizzia,412,8.6,12.7,65.1,4
Panite branza Nutrizzia (cereale extrudate),322.6,10.9,2.2,69.1,9.7
Panite felii crocante crisp bread Nutrizzia,321,23.2,0.2,54.6,9.7
Panite felii crocante Nutrizzia Siluet,324,10,1.4,59.8,15
Panite felii pufoase grau Nutrizzia,339,11.4,0.8,70.3,13.3
Panite felii pufoase multicereale Nutrizzia,355.6,9.8,1.7,73.9,9.7
Panite felii pufoase orez Nutrizzia,379,8,1.1,82.9,2.9
Panite glazurate cacao Nutrizzia,443,8.6,16.9,63.8,9.7
Panite glazurate Iaurt Nutrizzia,441,8,17.3,61.4,9.7
Panite graham Nutrizzia (cereale extrudate),324.5,10.3,2,69.9,10.3
Panite integrale Nutrizzia (cereale extrudate),302,10.2,1.5,67.8,15.7
Paste alfabet Panzani,365,13,2,72,3.6
Paste cannelloni Cora,360,12,1.5,73,3
Paste capellini Barilla,350,12,1.5,72.2,3
Paste Cornetti Titan,339.4,9.4,2.6,69.6,0
Paste cous-cous cu ou Monte Banato,382,12,1.1,75,0
Paste cu ou Fratelli Pignatti,253,9.6,1.6,50,0
Paste cu ou Monte Banato,382,12,1.1,75,0
Paste cu ou si negru de sepia Giovanni Rana,279,11.2,4,49.6,3
Paste din faina de orez Riso Scotti,336.7,6.5,0.7,76.2,3.6
Paste elicoidali Granoro,352,12.5,1.5,72,1.8
Paste fainoase Conchiglie Baneasa,350,11,0.7,75,0
Paste fainoase cu morcivi si rosii Barilla ,357,13,2.5,68.3,4.5
Paste fainoase cu ou Arnos,365,11.3,3,73.2,0
Paste fainoase cu ou Baneasa,361,13.7,2.2,71.6,0
Paste fainoase cu ou Divella,365,14.7,3.8,68.1,0
Paste fainoase cu ou pentru wok Vitasia,366,14,2.6,70,3.3
Paste fainoase D'oro Arpis,350,10,1.1,72,0
Paste fainoase din faina de secara Karmel,328,9.3,1.7,66.6,14.6
Paste fainoase Emiliane Barilla,365,15,4.5,66,3
Paste fainoase farfelle Brailla,357,12.5,1.8,75,3.6
Paste fainoase Fidelini Monte Banato,365,14.9,2.8,70,0
Paste fainoase integrale penne rigate Barilla,351,12.5,2.5,66.7,6
Paste fainoase La Grande Famiglia,350,11,0.7,75,0
Paste fainoase maccaroni Baneasa,365,11,0.7,75,0
Paste fainoase melci ondulati Proxi,348.7,11,0.9,75.5,2.4
Paste fainoase mini fusilli Panzani,354,12,2,72,0
Paste fainoase Noe,350,13,0.8,73,0
Paste fainoase penne Barilla,357,12.5,1.8,75,3.6
Paste fainoase pennette rigate Barilla,361,12,1.5,72.2,3
Paste fainoase scoici Gata,350,11,0.7,75,0.6
Paste fainoase speciale pentru copii Fizi Filiz,363,11.3,1.4,76,0
Paste fainoase spirelli 365,348,11.8,1.5,72,0
Paste fainoase Stelline Barilla,356,11,1.5,73.2,3
Paste fainoase tagliatele Arnos,354,11.5,1.9,72.7,0.8
Paste fainoase tagliatelle cu ou din faina de grau dur Da Marco,343,14,3,65,0
Paste fainoase taitei Baneasa,350,11,0.7,75,0
Paste fainoase tortelini cu ricotta si spanac Barilla,411,14.3,14.3,57.1,7.1
Paste fainoase tortelini cu ricotta si spanac Finno,285,10,6.5,46.8,0
Paste fainoase Toscana,351,10.5,1.3,75,0
Paste fara ou Boromir,350,11,0.7,75,0
Paste farfalle Carrefour,366,12.5,1.5,75,2.5
Paste fusili Dr. Man,328.3,26.9,6.6,38.2,16.8
Paste Fusilli KClassic ,358,11.5,1.5,73.2,3
Paste fusilli n.98 Barilla,356,12,1.5,72.2,3
Paste fusilli spirale extra Arpis,350,10,1.1,72,0
Paste grau Esselunga,353,13,1.5,71.8,0
Paste integrale Ditali Probios,325,13,2.6,62.2,8.6
Paste integrale fusilli Barilla,349,12.5,2,67.2,6
Paste integrale fusilli Divella,330,12,2.2,65.5,6
Paste integrale fusilli Misura,286,11,2,56,6
Paste integrale Misura,335,13,1.5,67.5,6.4
Paste integrale nefierte,348,14.6,1.4,75,8.3
Paste macarron Alipende,338,12,2,68,0
Paste N7 Spaghettoni,356,12.5,1.5,71.7,3
Paste papillons Pates d'Alsace Cora,373,15,5,67,0
Paste Penne,357,12.5,1.8,75,3.6
Paste penne 365,365,10,1,75,1.5
Paste penne rigate Baneasa,350,11,0.7,75,0
Paste penne rigate Combino,360,12,1.3,73,3
Paste Pipe Rigate Combino,352,12,1.3,73,0
Paste pipe rigate135 Novella,356,12,1.5,72,3
Paste ravioli cu branza Monte Banato,338,11.3,6.2,59.4,0
Paste soia Dr. Man,328,26.9,6.6,38.2,16.8
Paste spirale Domani,350,10,1.1,72,0
Paste spirale Monte Banato,365,11.9,1.6,75.8,0
Paste tagliatelle cu spanac Barilla,347,12,1.5,71.4,3
"Paste, 2 oua",379,14,2.6,75.1,3.2
"Paste, 4 oua",392,15,3.4,72.9,3.2
"Paste, 8 oua (de casa)",400,17,5,69.2,3.2
Penne cu 5 legume Panzani,351,13.1,1.6,68,6.3
Penne din faina integrala de grau organic  La terra e i cielo,356,12.5,1.6,73,0
Penne integrale 100% Probios,335,16.2,2.2,62.5,7.1
Penne Rigate Kaufland,358,11.5,3.2,73.2,3
Penne Rigate La Capannina,358,12,1.1,75,0
Penne Rigate Panzani,354,12,2,72,0
Penne Rigate Titan,339.4,9.4,2.6,69.6,3.6
Perle Tapioca Sanovita,351,0,0.2,85.3,0
Pernute de cereale cu ciocolata si musli Dr. Oetker Vitalis,450,8.9,14.9,67.4,5
Pernute de cereale cu vanilie si musli Dr. Oetker Vitalis,453,8.2,14.7,69.7,4.3
Pesmet,342,10.2,0.9,73.3,3
Pesmet (alb) dulce,398,11.3,5.1,74.2,2.4
Pesmet alb Titan,369,12,1,78,0
Pesmet alb Winny,369,12,1,78,0
Pesmet Delhaizer,346,11,1.2,72.8,3.2
Pesmet din paine alba Vitastar,360,12.3,1,74.6,1.6
Piscoturi cu oua Savoiardi,385,8.7,3.3,80.2,2.5
Piscoturi cu oua Savoiardi Boromir,378,8,2.8,80,0
Piscoturi Savoiardi Balocco,377,8.4,3.7,77.6,2.7
Pogacele cu unt,204,4.3,9.8,23.3,3
Porumb dulce in vid Olympia,118,3.9,1.3,22.7,2
Porumb fiert,96,3.4,1.5,21,2.4
Porumb fiert Kaufland,89,2.9,2.5,11.2,2.8
Porumb incoltit,476,18.8,34.5,19,2
Quinoa ,368,14.1,6.1,64.2,7
Quinoa bio All Green,355,12.2,5.5,62.5,7
Quinoa gatita,120,4.4,1.9,21.3,2.8
Quinoa organic Now Foods,380,14,6,70,12
Rondele crocante de grau expandat Linia Velt,362,13.5,0.9,74,3
Rondele de orez expandat Crusti Croc,392,8.2,3.2,81.1,3.2
Rondele de orez expandat cu aroma de caramel Stilla Fitness,377,6.1,0.9,84.8,2.2
Rondele de orez expandat cu aroma de mar si scortisoara Stilla Fitness,381,6,0.8,86,2.2
Rondele de orez expandat cu glazura de ciocolata Stilla Fitness,455,6.8,15.3,72.1,1.7
Rondele de orez expandat cu iaurt Stilla Fitness,454,6.3,15.7,69.9,0
Rondele din grau expandat cu glazura de ciocolata SanoVita,431,9,13.1,68.5,0
Rondele din grau expandat cu glazura de iaurt SanoVita,457,9.2,15.3,69.9,0
Rondele din grau expandat Sanovita,364,13.5,0.9,74,3
Rondele din grau expandat Solaris,362,13.5,0.9,74,2
Rondele din orez expandat Sanovita,397,8,3,83,3
Rondele grau expandat Stilla Fitness,340,11.4,0.8,70.3,13.3
Rondele orez expandat eco Irma,390,7,4,81,0
Secara,335,14.8,2.5,69.8,14.6
Seminte de chia SanoVita,451,22,31.3,35.3,30.2
Seminte de in BIO Natura,586,18.3,42,30.4,27.3
Seminte de susan Pirifan,592,20,55,1,0
Soia boabe SanoVita,467,35,20,22,3
Soia Darling,353,52,1,32,2
Soia germeni,31,1.8,0.2,5.3,2
Spagete nr. 5 Barilla,337,12.5,2,67.2,6
Spaghete Baneasa,350,11,0.7,75,0
Spaghete Barilla,350,12,1.5,72.2,3
Spaghete Classic Kaufland,358,11.5,1.5,73.2,3
Spaghete crude,379,14,2.6,75.1,3.2
Spaghete cu ou Monte Banato,382,13,1.1,75,0
Spaghete De Cecco,355,13,1.5,73,0
Spaghete din faina de orez,336.7,6.5,0.7,76.2,0
Spaghete din grau dur Combino,358,12,1.3,73,3
Spaghete din grau dur Cora,344,13,2,65,7
Spaghete din grau dur Fior Di Pasta ,360,11.5,1.5,73.6,0
Spaghete fierte,158,5.8,0.9,30.9,1.8
Spaghete integrale Combino,351,12,1.9,68,6.8
Spaghete integrale din grau spelt Bio Rinatura,347,14,3,60,12
Spaghete integrale nr. 5 Barilla,351,12.5,2.5,66.7,6
Spaghete integrale Pambac,312.6,13,2.4,65,10.5
Spaghete integrale Vita D'or,329,12,2.3,65,10
Spaghete integrale Vollkorn Bio,330,12,2.2,65.5,0
Spaghete La Collezione Barilla,360,14,3.5,68,3
Spaghete no. 3 Barilla,365,12.5,1.3,71.7,3
Spaghete orez vermicelli Oh! Ricey,354,6,0.2,82.2,0
Spaghete Pambac,350,11,0.7,75,0
Spaghete Pasta D'Oro Arpis,350,10,1.1,72,0
Spaghetti Integrali De Cecco,328,14.5,2.5,62,7.5
Spaghetti integralli De Cecco,335,14,3,62.5,8
Taitei chinezesti de soia fierti,17.6,0.9,0.9,3,2
Taitei chinezesti Lidl,366,14,2.6,70,3.3
Taitei cu ou si cu grau dur Monte Banato,363,14.3,1.5,73,0
Taitei de casa lati si ondulati Hutton,391,13,2.8,76.5,0
Taitei de casa Pambac,362,12,1.6,75,0
Taitei de orez Delhaize,365,7,0,80,0
Taitei dietetici Baneasa,340,12.5,1.2,70.5,3.5
Taitei din faina de orez Vifon,991,8,0,240,2.4
Tarate de grau,216,15.6,4.3,64.5,42.8
Tarate de grau Bio Greno,263,14.9,4.7,45.4,17.5
Tarate de grau Luomu,143,15,1,9,55
Tarate de grau Pirifan,293,2.9,0.2,80.6,37
Tarate de grau Solaris,358,16.2,3.1,62.6,41
"Tarate de grau, orz, secara Solaris	",230,14.9,4.6,56.5,24
Tarate de orez Now Foods,466.7,20,20,53.3,13.3
Tarate de orez Now Foods,462,19.8,19.8,52.8,13.2
Tarate de ovaz CozoPIRI,337,17.1,7.9,64.1,15
Tarate de ovaz eco Salim,330,16.6,8.6,46.6,16
Tarate de ovaz Hacendado,358,17.6,8.7,44.1,16.5
Tarate de ovaz Pirifan,389,12.1,6.9,67.1,4.7
Tarate de ovaz Sano Vita,326,17.6,8.7,60.6,16.5
Tarate de ovaz Sanovita,407,17.6,8.7,60,16.5
Tarate de ovaz Solaris ,246,17,7,60.4,15.4
Tarate Hacendado,289,15,5.4,26,37
Tartine (rondele) din orez ecologic Scotti Risette,381,8.1,2.8,80.9,3.9
Tartine de orez cu quinoa Lima,399,7.9,3.7,83.5,25
Tartine din grau Carrefour,358,13.5,0.9,74,3
Tartine din grau ecologic Risette Scotti,364,13.5,0.9,74,1
Tartine din grau ecologic Scotti,364,13.5,0.9,74,0
Tartine din orez Carrefour ,381,8,2.8,81,3
Tartine din orez ecologic Scotti,381,8.1,2.8,80.9,3.9
Tartine integrale Auchan,386,11,4,73.2,6.5
Tartine multicereale Lima,395,9.8,3.1,82,0
Tortellini cu carne Monte Banato,378,12.5,7,65,0
Tortellini cu ciuperci Monte Banato,330,13.9,5.4,56.5,0
Tortilla din faina de grau Poco Loco,317,9.3,7,54.2,3
Wafe din orez cu ciocolata cu lapte Hig,480,7,20.8,65.7,0
Wafe din orez expandat cu iaurt Hig,487,5.6,20.6,69.8,0
Wafe orez cu porumb Hig,393,8.9,3.5,81.5,0
Wafe orez cu susan Hig,386,9.4,2.8,80.7,0
Wafe orez fara sare Alnatura,401,8.8,3.3,82.5,0
Wafe sare de mare Hig,390,8.6,3.5,81,0
