Aluat instant pentru paine taraneasca cu adaos de drojdie uscata Rivercote,228,7.7,0.9,47.3,4.8
Alune de padure crude Poex,652,12,62,11,8.2
Amestec cereale integrale Integral-R Rommac,320,11.5,3.3,60.8,20
Amestec de cereale Pirifan,356,11.5,3.9,68,0
"Amestec tarate psyllium, ovaz, in, carob SanoVita",133,7.2,8.2,6.5,24
Amidon,335,0.6,0.1,83.1,0
Amidon (grau),348,0.4,0.1,86.1,0
Amidon (porumb),346,0.3,0.1,85.9,0
Arpacas de grau Deroni,375.2,9.8,2.2,79.1,0
Arpacas de orz,352,9.9,1.2,77.7,15.6
Baton cereale Corny Activ,349,7.1,13.7,46.1,16.8
Baton cereale cu cacao Winny,389,7,6.8,74,3.2
Baton cereale cu ciocolata Aptonia,424,7,14,67.5,5.2
Baton cereale cu ciocolata fara zahar Corny,325,6.4,10.4,66.3,3.3
Baton cereale cu ciocolata Nestle Fitness,393,5.8,3.9,70.7,4.3
Baton cereale cu fructe rosii Aptonia,389,5.3,8.9,71.8,4.2
Baton cereale cu mere si pere Stilla Fitness,350,7.2,5,72,0
Baton cereale cu piersici si caise Stilla Fitness,339,6.3,5,70,0
Baton cereale integrale cu fructe tropicale si iaurt Rommac,321,6,2,77,10
Baton cereale Lion Nestle,402,8.3,5.6,77.2,4.8
Baton cereale si cacao Mulino Bianco,447,7.5,19,61.5,7.5
Baton cereale Special K,383,8,5,77,2
Baton cereale Winny,396,5.9,7.2,76,3
Baton cu cereale miere si seminte Rommac,389,6.1,4.8,80,3
"Baton cu cereale, miere, mere si caise Rommac",384,7.8,3.5,80.5,2.5
"Baton cu cereale, miere, visine si catina Rommac",381,5.9,4.6,80,3
Baton cu ciocolata si musli crocant Hahne,423,9.2,15.3,58.4,7.7
Baton cu muesli si caise FirstNice,374,4.3,7.7,71,0
Baton cu musli si alune Big Free Corny,345,11.9,6.9,64.8,0
Baton cu musli si alune de padure Crip Crop,393,6.9,14.4,61.8,0
Baton cu musli si alune Fit & Activ Riegel,406,9.2,15.2,58,8
"Baton cu musli, banana si ciocolata Crip Crop Crunchy",442,8,18,62,0
"Baton cu musli, caise si iaurt FirstNice",396,4.6,15.3,60,0
Baton cu ovaz si fructe Activ Bar Rommac,321,6,2,77,10
"Baton cu rez, porumb, susan expandate Nias",376,8.7,0.5,84.7,0
Baton de cereale ciocolata si coji de portocale Fitness Nestle,374,5.1,5.2,73.4,4
Baton de cereale fitness cu alune Stilla Fitness,358,7.6,11,65.6,0
Baton de cereale Fitness Nestle,382,5.1,7,74.8,13.4
Baton de cereale Morning Sun,445,4.9,19.8,61.9,4.4
Baton de cereale si capsuni Fitness Nestle,391,5.4,7.1,70.1,4.3
Baton de musli cu ciocolata Musli-Riegel Fit & Activ Plus,444,8.4,18,62,0
Baton de susan cu miere Rommac,524,13.5,30,50,4.8
Baton musli cereale si visine Nestle,382,5.8,7.2,67,4.5
Baton musli ciocolata stafide Nestle,401,5.6,9.8,70.4,0
Baton musli cu afine in glazura de iaurt Stilla Natura,350,4.9,11.3,60.2,0
Baton musli cu fructe de padure si glazura de iaurt Crip Crop,405,5.3,14.5,66.2,0
"Baton musli cu merisoare de padure, zmeura cu glazura de iaurt Crip Crop",405,5.3,14.5,66.3,0
Baton musli cu zmeura First Nice,367,6.9,5.5,71.9,5
Baton musli lime si ciocolata Galaxy,417,6.9,17.6,58.6,5.5
Batonase hipoglucidice Dobrogea Group,110,3.8,1.3,20,0
Bautura din hrisca Bio Grano,57,0.6,1.5,10.2,0.5
Biscuiti  Maria integral Gullon,429,8,12,73.3,4.7
Biscuiti bogati in fibre Sunny Bisk Bokomo,353,13.1,1.6,77.2,12.6
Biscuiti Classico Grancereale Mulino Bianco,460,8,19.9,56.6,11
"Biscuiti cu cereale integrale, stafide si visine Fit Ulpio ",427,7.6,15.2,61.6,3
Biscuiti cu susan si mac Croco Mix,470,26,12,61,0
"Biscuiti digestivi cu prune, smochine si stafide ETI Burcak",417,8.4,19.4,52.2,11
"biscuiti digestivi din faina integrala cu fulgi de ovaz, grau si chipsuri de ciocolata neagra Gullon",483,8.9,21.9,59.6,5.5
Biscuiti digestivi ETi Burcak,450,7,18,71,12
Biscuiti digestivi Gullon,480,6.9,21.3,65.2,2.6
Biscuiti digestivi Viva,451,7,19,63,7
"Biscuiti fara sare si fara zahar adaugat, cu indulcitori Ligera Gullon",406,9.3,12.7,55.8,18.2
Biscuiti fara zahar bogati in fibre Korpovit,375,15.4,12.7,49.7,16
Biscuiti fara zahar Gullon,375,11.3,12.8,53.8,18.2
Biscuiti Frutta Mulino Bianco Grancereale,457,7.5,19.5,57.4,11
Biscuiti graham Baragan,350.5,14.1,9.3,52.6,0
Biscuiti Nutri-Grain Kellogg's,429,8.5,15,59,13
Biscuiti ovaz Ikea,496,4.8,24,62,0
Biscuiti petit biscotti Secchi,439,8.4,11.7,74.9,2.6
Biscuiti Salatini,490,8,25,61,1.4
Biscuti cu cereale Hipofita Plevnei,294,0,0,0,0
"Biscuti cu cereale, lapte si stafide Tismana",455,7.1,18.2,70.5,9.3
Boabe de hrisca integrale Pirifan,343,13.3,2.7,71.5,10
Boabe de naut 365,353,19.5,4.8,58,0
Boabe naut Sanovita,389,19,5.5,58,5
Briosa,346,9.5,7.5,57.8,3.2
Cannelloni Buitoni,350,11.5,1.9,71.8,3
Cereale 90% fructe uscate Exotic Sanovita,312.8,5.9,17,67.7,1.4
Cereale All Bran Kellogg's,323,12,1.5,81,15
Cereale Bixies Sanitarium,356,12.4,1.4,67,11
Cereale Cheerios  Nestle,375,7,3.7,78.5,5.2
Cereale cocoa balls Viva,373,6,5,76,3
Cereale cookie crisp Nestle,377,6.4,3.4,35.3,5.2
Cereale Cookie Crisp Nestle,375,6.3,3.1,80.4,5.3
Cereale Crispy Millet SanoVita,388,8,3,80,3.8
Cereale cu cacao Choco Shells Distins,389,8.1,3,76,6.5
Cereale cu ciocolata Brumi,384,7.2,2.8,82.5,4.6
Cereale cu ciocolata fara gluten Gerble,372,7.8,2.6,79.3,3.1
Cereale cu fructe Fit-Grain Mr. Breakfast,340,6.4,2.5,73.1,5.3
Cereale cu fructe muesli Dia,322,8.6,6,60.9,3.5
Cereale cu fructe Proxi,330,9.5,3.8,64,10
Cereale cu fructe si nuci All Bran Kellogg's,380,8,6,69,9
Cereale cu germeni de grau pentru dieta Titan,380,8.7,14.9,52.7,0
"Cereale cu lapte, mar si morcov Milupa",438,12.7,12.7,68.2,1.1
Cereale cu miere si alune Honey & Nut Flakes K-Classic Kaufland,400,8.9,7.2,72.4,5
Cereale cu miere Viva Honey Rings,396,6,3.5,83,4
Cereale cu migdale si nuci Almonds Nuts Granola Nestle,414,9.7,9.6,68.1,8.3
Cereale cu musli si fructe Integral-R Rommac,360,9,7,65,9.7
Cereale cu musli Solaris Plant,282.9,9.3,9.9,49.7,9.7
Cereale cu scortisoara Brumi,411,6.7,8.4,77.1,2
Cereale cu scortisoara Nestle Cini Minis,420,5,9.9,75.7,4.1
Cereale cu scortisoara Viva Star,459,5,15,75,2
Cereale de corumb corn flakes bio Delhaize,378,6.9,0.9,84.3,2.5
Cereale de grau cu musli Trauben-Nuss,392,11,12,60,10
Cereale de grau integrale Weetabix,338,11.5,2,64.4,10
Cereale de porumb corn flakes K-Classic Kaufland,390,8.9,2.2,82.4,2.4
Cereale de porumb Corn Flakes Nestle,376,7.3,1.5,83.4,3
Cereale de porumb Winny,387,8,1.5,85.5,2
Cereale din orez Rice Krispies Kellogg's,380,6,1,87,1
Cereale din tarate de grau cu 7 vitamine si fier Absolut Bran,236,16.3,2.2,37.7,35.5
Cereale exotice Goody Vitelle,371,7.1,3.2,75.7,5.4
Cereale expandate Bobita,364,6.8,0.4,86.8,6.6
Cereale extrudate sub forma de ineluse cu miere si scortisoara Crispyrings,390,6,4.5,81,4.3
Cereale Fit & Form Viva,384,6.6,3.5,70,5
Cereale fitness Stilla Natural,384.9,7.8,1.3,83.9,3.2
Cereale flakes pure Kaufland Classic,376,12.7,2.9,67.8,14.9
Cereale fruits&fibres Auchan,381,10,8.5,66,9
Cereale Fruity Muesli Tilo's,321,10.9,2.6,63.6,10.7
Cereale Gold Flakes Nestle,396,7.1,4.4,81.9,2.4
Cereale granola Tilo's,395,10,10,70,8
Cereale integrale Cora,396,7.1,3.6,83.8,4.4
Cereale integrale cu 30% fructe deshidratate Distins,332,9.6,4,68.2,0
Cereale integrale cu vitamine Carrefour,374,8.1,1.5,82,4.4
Cereale integrale de grau Nestle,363,8,1.3,79.8,5.1
Cereale integrale de grau Shreddies Nestle,209,8.3,2.8,35.6,3.9
Cereale integrale Diet Dobrogea,346,8.7,1.9,71.3,16.4
Cereale integrale Fitness,372,8.4,1.4,78.4,1.4
Cereale Kellogg's All Brann Original,250,11.1,2.8,75,33.3
Cereale Kellogg's All Brann Plus,280,14,3.5,48,27
Cereale Kellogg's Special K,374,15,1.5,75,2.5
Cereale mic dejun Lion Nestle,402,8.3,5.6,77.2,0
Cereale miere si caramel Cora,346,8.6,1.7,74,5.6
Cereale musli cu fructe Rommac,330,8.2,4,69,10
Cereale musli cu fructe Sanovita,402,9.8,8.3,71.4,4
Cereale musli integrale 30% fructe Carrefour,360,9,7,65,11
Cereale musli integrale stafide si nuci Lidl,368,10.8,9.3,54.9,10.8
Cereale Musli Nuts Sanovita,362,8.7,11.5,69,2
Cereale Musli traditional Nestle,358,11.3,6.5,63.7,7.7
Cereale musli tropical Nestle,365,9.3,6.9,66.3,7.2
Cereale musli tropical Nestle,381,9.2,7.1,66.3,7.7
Cereale Nesquik Duo Nestle,400,7.8,6.1,75.6,5.3
Cereale Nestle Chocapic,382,8.4,2.8,76.2,0
Cereale Nestle Cini Minis,412,4.9,9.9,75.9,4.1
Cereale Nestle Fitness Chocolate,398,7.9,6.3,74.8,5
Cereale Nestle Fitness cu fructe,353,6,2.1,77.4,5
Cereale Nestle Nesquik,386,8.1,3.9,76.1,6.3
Cereale orez si grau integral Delhaize,370,11,1.5,78,3.5
Cereale simple Nestle Fitness,369,8.4,1.3,77.6,6.2
Cereale tarate ovaz gust caramel Dukan,298,13.1,7.8,27.4,6.2
Cereale vanilie si scortisoara Go Light Rommac,340,7.9,2.1,75,6.5
Complex din fulgi de cereale cu stafide Sanovita,393,10.3,3,77.4,0
Conserva boabe naut fierte Divella,72,4.3,1.3,8.6,4.5
Conserva porumb dulce auriu D'Aucy,91,2.9,2.4,12.2,3.6
Corn,242,10,0.8,50.8,2.5
Cous cous Barilla,356,12,1.5,72.2,3
Cous Cous Panzani,369,13,2,73,3.4
Cous cous Urtekram,360,11,2.3,69,7.7
Cous-cous fiert,159,4,1,31,1
Cous-cous nepreparat,356,13,1,72,2
Cous-cous nepreparat Divella,341,11.3,1.3,71,0.2
Covrig patiserie cu sare,331.4,10.5,7.1,56.6,2.8
Covrigei,378,10,3,79,5
Covrigei Capollini,410,10,13,71,0
Covrigei cu sare Capollini Pan Group,442.5,9.5,12.5,73,0.6
Covrigei cu sare Jack Pot,406,10,6,78,0
Covrigei cu tarate Mini Feast,399.5,8.1,11.5,70.6,0
"Covrigei superiori cu rosii, busuioc si oregano Boromir",429,10.9,10.3,73.3,0
Covrigei ulei de masline Boromir,501,10.8,18.3,73.2,0
Covrigei vanilati Dorivi Prodcom,441.4,10.2,12,73.1,0
Covrigi,320,11,1,71,3.4
Covrigi de Buzau Boromir,418,11.2,6.1,77.4,0
Crackeri cu mere si scortisoara Vitasnella,397,6,8.5,74,3
Crackeri fara colesterol Misura Novita,382,13.9,9.6,60,11.8
Crackeri integrali Crich,425,11.1,13,65.9,8
Crackeri integrali Delhaize Mega Image,360,12,5,67,8
Crackeri integrali Misura,387,12.8,10.9,59.3,11.5
Crackeri Magretti Galbusera,370,11.6,1.5,77.4,4
Crackers cu ulei de masline extravirgin si rozmarin Crich,429,10.9,12.1,69.1,3.5
Crackers de orez Teriyaki Delhaize,401,8,3.6,85,0
Crutoane cu ulei de masline Panmonviso,438,11.5,15.5,63.2,15
Cus-cus Arnos,362,10.9,2.4,74.2,0
Faina alba,364,10.3,1,76.3,2.7
Faina alba 650 Castello,346,9.5,1.3,74.1,0
Faina alba de grau 000 Grania,358,11.5,0.9,76,0.6
Faina alba de grau 650 Aro,347,10.3,1,72,1.4
Faina alba de grau 650 Auchan,343,10.5,1,72.9,0
Faina alba de grau 650 Kaufland,342,10,0.9,73.6,0
Faina alba de grau 650 Pambac,347,10.6,1.3,73.2,0.6
Faina alba de grau Dobrogea,384,11.5,1,80,1.1
Faina alba pentru prajituri Drobrogea,380,10.5,1,80,1.1
Faina alba superioara 000 Arpis,352,11,0.9,73,0
Faina alba superioara Boromir,346,10.3,0.9,74.2,0
Faina alba superioara de grau Castello,345,10,0.9,74.2,0
Faina alba superioara Pambac,352,10,0.9,76,0
Faina alba tip000 Titan,342,10,0.9,73.6,0
Faina Bio integrala de secara Verival,289,10.8,1.5,58.8,13.5
Faina de grau alba 550 Baneasa,345.5,9.5,1.1,74.4,0
Faina de grau alba superioara 000 Baneasa,346,10.7,0.9,73.1,1.3
Faina de grau integrala Grafschafter,307,11.4,2.4,60,10
Faina de grau integrala Solaris ,367,10,1.6,73.3,10.4
Faina de grau macinis integrala Dobrogea,349,12.5,1.9,68.2,19
Faina de grau neagra Baneasa,358,11.2,2.1,73.6,0
Faina de grau neagra pt masina de facut paine Baneasa,347,10.5,1.4,72.1,2
Faina de hrisca Solaris,383,16.7,5,66.7,10
Faina de migdale Solaris,585,26,51,13.5,0
Faina de naut,387,22.4,6.7,57.8,10.8
Faina de orez,359,6.9,0.6,79.4,1
Faina de ovaz Solaris,385,14.8,5.2,70,10
Faina de patiserie dietetica SanoVita,328,27.6,6.8,39.2,17.2
Faina de porumb (malai),366,8.5,1.7,77.7,7.4
Faina de secara,354,9.4,1.8,77.5,14.6
Faina de secara Boromir,361,9.3,1.7,74.9,0
Faina de secara integrala Bio Greno,320,10.8,1.5,58.8,0
Faina de secara integrala Solaris Plant,335,11.6,1.9,67.8,2.3
Faina de secara Pirifan,323,9,1.3,67.8,7.7
Faina de soia degresata Sanovita,380,47,7,34,0
Faina de soia Pirifan,450,18,18,54,0
Faina din soia Solaris Plant,372,46.5,6.7,37.9,10.2
Faina Dura Food,366,12.3,1.3,76.3,0
Faina Eroski,331,10.5,1.2,69.6,5.5
Faina Espigas De Oro ,339,10.6,0,71.8,4
Faina integrala,339,13.7,1.9,72.6,12.2
Faina integrala 7 Spice Vel Pitar,327,13.3,2.3,56.2,13.8
Faina integrala de grau Cora,340,11.6,1.6,68.7,2.4
Faina integrala de grau ecologica Natura Land,347,14.2,1.8,66.8,2.4
Faina integrala de grau Grania,336,11.6,1.6,68.7,12.2
Faina integrala de ovaz Pirifan,378,14.6,1.6,64.3,0
Faina integrala de secara Dobrogea,334,10,1.9,65,8
Faina integrala din grau Sanovita,348,14.4,1.8,66.2,0
Faina integrala din ovaz Sanovita,388,14.4,6.8,64.3,4
Faina integrala din secara Sanovita,328,9.3,1.7,66.6,7.5
Faina integrala grau intreg 7 Spice Vel Pitar,328,12.6,2.2,73.2,12.8
Faina neagra de grau Boromir,347,10,1.1,74.4,0
Faina neagra Rivercote Lidl,228,7.7,0.2,47.3,4.8
Faina orz,345,10.5,1.6,74.5,10.1
Faina pentru paine multicereale Premix  Vitalbrot,316,13.9,6.8,53.1,0
Faina pentru paine Slabesti Mancand,326,25.9,6,42.2,16.6
Faina pentru painte integrala de casa Dobrogea,224,7.9,0.9,44,0
Faina pentru patiserie Slabesti Mancand,328,27.6,6.8,39.2,17.2
Fasole extra Sunshine,272,23.5,1.5,41.1,0
Felii cereale cu seminte Linia Velt Rommac,392,8.7,2.5,83.5,0
Felii crocante cu faina integrala graham Stilla Fitness ,342.8,10,0.8,70.8,3.9
Felii crocante cu secara Stilla Fitness,374,9.2,2.6,78.9,9.5
Felii crocante cu secara Stilla Fitness line,336.3,9.6,1.8,69.7,5.6
Felii crocante de secara si seminte de susan Casino,365,11,8.6,52,20
Felii crocante din porumb cu branza Stilla Fitness,382,10,4.2,76.1,3.2
Felii crocante integrale Burger,341,10.5,4.5,54.2,21
Felii de cereale Velt,353,9.6,1.9,73.5,6.5
Felii din cereale cu seminte Agapy,326,12.8,2.3,63.4,10.3
Felii orez expandat Plus,392,8.3,3,83.2,2.9
Fidea de casa cu oua Pambac,362,12,1.6,80,3
Fidea de orez Binh Tay,372,6,0,84,0
Fidea Yannco,320,1.8,0,80,0
Foccacia,263,8.8,8.8,36.8,1.8
Foi de lasagna Barilla,366,13.5,4,67,4
Foi lasagna cu spanac Barilla,352,12,1.5,71.4,3
Foi lasagna Monte Banato,353,11,1,75,5
Foi lasana Gallo,373,12.5,1,77,3
Fulgi cereale integrale Ballu's Rommac,373,7.8,2.9,78,4.3
Fulgi cereale integrale continut redus de zahar Distins,360,8.3,1.9,73.8,7.1
"Fulgi crocanti cu capsuni, zmeura si visine Nutrisslim",347,11.1,2,71.2,10.9
Fulgi cu cereale integrale si orez Rommac,373.9,8.1,1.5,82,4.4
"Fulgi cu cereale integrale si orez, cu fructe Rommac",362,6,2.3,79,4.3
Fulgi de cacao Viva,400,7.5,3.7,82,4.3
"Fulgi de cereale (grau, secara, ovaz, orz) Sanovita",320,11.5,3.3,60.8,9.7
"Fulgi de cereale (grau, secara, ovaz,porumb,orz) Sanovita",325,11.3,3.2,61.8,10
Fulgi de cereale cu iaurt Stilla Fitness,405.3,7.5,5.1,80.9,2.9
Fulgi de cereale Integrale Distins 3S Super Slim Siluet,406,9.9,2.7,85.6,6
Fulgi de cereale Multi Cereal Solaris Plant,313,11.6,2.8,72.3,13.1
Fulgi de grau,339,10,1,83,12
Fulgi de grau cu miere si caramel Hero,370,8,1.5,81,0
Fulgi de grau cu tarate Sanovita,357,10,2.4,72.6,0
Fulgi de grau cu vitamine Sanovita,334,10.8,2.4,67,11.6
Fulgi de grau germinat Granovit,308,13,1.8,58,9
Fulgi de grau integral cu fibre si pudra de cacao Linia Velt,340,8.7,2,75.4,7
"Fulgi de grau integral, fibre si pudra de cacao Rommac",340,8.7,2,75.4,7
Fulgi de grau Noe,317,11.6,1.6,56.3,9
Fulgi de grau Pirifan,350,10.6,1.8,72.3,0
Fulgi de grau Sanovita,301,11.7,1.8,59.6,0
Fulgi de mei SanoVita,388,8,3,80,3.8
Fulgi de orez natur Rommac,340,9,2,70,0
Fulgi de orz,386,14.4,6.8,64.3,15.5
fulgi de orz Agapy,318,11.9,1.6,57.3,2.7
Fulgi de orz Pirifan,352,11.9,3.6,67.3,0
Fulgi de orz SanoVita ,338,10.4,1.4,71,10
Fulgi de ovaz,246,17,7,66,15.4
Fulgi de ovaz Auchan,368,11,7.5,58,12
Fulgi de ovaz bio Alnatura,372,13,7,59.1,10.2
Fulgi de ovaz bio Delhaize,351,12.5,7.4,58.7,8.7
Fulgi de ovaz Carrefour ,354,14.9,7.6,56.5,9.5
Fulgi de ovaz Crispy Oat SanoVita,352,15,7,56,12.3
Fulgi de ovaz cu miere Quaker Oat so Simple,366,8.4,6.2,68.7,6.8
Fulgi de ovaz delicat Hahne,360,12.5,7,57,0
Fulgi de ovaz Fortin,366,12.5,7,63.3,5.4
Fulgi de ovaz integral Solaris,359,12.7,6.1,63.5,0
Fulgi de ovaz intergral Morning Sun,352,13.5,7,58.7,0
Fulgi de ovaz marunti Holiday,352,13.5,7,58.7,10
Fulgi de ovaz Mercanti,372,13,7,59.1,10.2
Fulgi de ovaz NaturTierra,371,12,7,65,4
Fulgi de ovaz Noe,354,13,6.2,62.5,9
Fulgi de ovaz Pirifan,355,15.5,7.4,57.5,8.7
Fulgi de ovaz Pronat,389,16.9,6.9,66.3,10.6
Fulgi de ovaz Quaker,356,11,8,60,9
Fulgi de ovaz Quaker Multifruit,371,8.3,5.7,68.2,6.9
Fulgi de ovaz Rommac,320,10,4.7,58,6.8
Fulgi de ovaz Sanovita,352,13.5,7,58.7,0.5
Fulgi de porumb,357,7.7,0.6,85.7,3.6
Fulgi de porumb 365,378.5,8,0.5,85.5,0
Fulgi de porumb Carrefour,356,7.8,0.8,81.4,0
Fulgi de porumb Clasic vitamine si fier Rommac,370,6.9,1.5,82.4,3
Fulgi de porumb Clever,376,7.4,1.5,81.4,0
Fulgi de porumb Cribbits,358,8.1,1,80.4,4.2
Fulgi de porumb cu ciocolata Fortza Titan,393.1,8.6,2.7,83.4,0
Fulgi de porumb cu fructe exotice Sanovita,313.1,5.9,17,67.7,1.4
Fulgi de porumb cu miere Fortza Titan,423.1,6.6,7.9,81,0
Fulgi de porumb cu multivitamine si fier Fortza Titan,378.5,8,0.5,85.5,3.6
Fulgi de porumb Distins,376,7.7,1,85.4,1
Fulgi de porumb fara zahar Agapy,355,8.2,1.3,72.5,2.1
Fulgi de porumb fara zahar Pirifan,335,8.2,1.3,72.5,2.1
Fulgi de porumb fara zahar Sanovita,370,8.6,0.8,82.2,0
Fulgi de porumb fara zahar Solaris,368,8,1.5,85,3.6
Fulgi de porumb Goody,375,8.2,1.3,81.5,2.3
Fulgi de porumb Granovit,371,8.2,1.2,81.8,1.4
Fulgi de porumb Proxi,374,6.6,0.7,84.4,0
Fulgi de porumb Stilla Natura,384.7,7.9,1.2,84.6,2
Fulgi de porumb Winny,390,8.4,1,84.5,0
Fulgi de secara,322,9,1.5,66,14.8
Fulgi de secara Pirifan,352,9.7,2.6,70.8,0
Fulgi de secara Sanovita,296,9.5,1.7,60.7,0
Fulgi de secara Solaris Plant,322,9,1.5,66,12
Fulgi din cereale cu fibre din roscoava si vanilie Linia Velt,340,7.9,2.1,75,6.5
Fulgi din cereale integrale germinate Granovit Alfa-Beta,325,11,3.2,61.8,9
Fulgi din porumb corn flakes Viva,400,6.8,2.3,87,2
Fulgi grau Bulgur Bohlsener Muehle,235,4,1,52.5,4.4
Fulgi multi grain Sano Vita,320,11.5,1.7,60.8,7
Fulgi ovaz bio Ota SolGryn,359,13,7,56,10
Fulgi ovaz cu seminte canepa Canah,441,19,18.5,51,20
Fulgi ovaz extra fini Bulkpowders,361,11,8.1,61.1,8.5
Fulgi ovaz Flocons d'Avoine Auchan,368,11,7.5,58,12
Fulgi pentru piure Maggi,350,9,3.4,70.6,5.8
Fulgi petale de orez si grau integral Cora,381,10,1.4,80,4
Fulgi porumb Aro,391,7.8,1.8,85.2,1.4
Fulgi porumb imbogatit cu 8 vitamine K Classic,390,8.9,2.2,82.4,2.4
Fulgi porumb Stilla Fitness Kaufland,371,7.8,1.4,81.8,4.1
Fulgi presati din grau integral Sanitarium Weet-Bix,356,12.4,1.4,67,11
Fusilli tricolori La Capannina,358,12,1.1,75,0
Galete din orez 365,380,7.6,3.5,79.1,0
Germeni de grau,360,23.2,9.7,51.8,13.2
Germeni de grau bio Probios,360,23,9.7,51.8,13.2
Germeni de grau Sanovita,350,8.7,10,56.3,1.6
Germeni de grau Solaris,360,15.5,12,52.5,6.5
Gluten din grau SanoVita,376,77,1.4,9.5,0
Gnocchi di patate Bertagni,146,3.5,0.3,32.3,0
Gransoare Carefour,372,8,1.3,80,5.9
Grau bulgur germinat granovit Solaris,308,13,1.8,58,9
Grau expandat dulce cu gust de fructe Triti Bell,383,6.5,1,87.6,4.1
Grau germinat Carrefour,308,13,1.8,58,9
Grau incoltit,349,25,8,42,11
Grau seminte,347,14.4,1.8,72,12.2
Grausoare dietetice,372,9.6,1.6,80,0
Gris bio All Green,350,12,1.5,72,3.5
Gris Bunetto,328,10.3,1,67.9,0
Gris de grau,360,12.7,1.1,72.8,3.9
Gris de grau Hajdu,349,9.4,1,73.4,0
Gris de grau salbatic Verival Bio,339,9.4,68.8,0.9,0
Gris de la Arpis,352,11,0.9,73,0
Gris din grau Titan,343,11,0.8,73,0
Hrisca,343,13.2,3.4,71.5,10
Hrisca Bunetto,335,12.6,3.3,63.2,0
Hrisca Sano Vita,341,12.6,3.3,68.2,3.7
Inlocuitor de cafea din cereale Breakfast,351,5.5,0,81.9,7.7
Linguine De Cecco,346,13,1.5,70.2,3.5
Linte rosie decorticata Trs,318,23.8,1.3,56.3,5
Lipie,270,8.1,2.7,51.4,4.1
Lipie Carrefour,317,9.3,7,54.2,0
Lipie cu ierburi Deli Wraps,319,7.1,7.8,53.8,2.8
Lipie graham,266,10,3,55,7
Macaroane nefierte,371,13,1.5,74.7,3.2
Malai Boromir,349,7,1,78,1
Malai extra Arpis,352,7,1,78,0
Malai extra Baneasa,348,8.9,1,75.1,0
Malai extra Cora,352,7,1,78,0
Malai extra degerminat Top Apetit,352,7,1,78,0
Malai extra Pambac,349,7,1,70,7.2
Malai grisat degerminat Malaiul lui Enache,368,8.7,2,76.6,0
Malai grisat extra Dobrogea,352,7.2,1,75,0
Malai pentru mamaliga Panzani,355,8.2,1.1,78,0
Malai pentru mamaliga Spar,350,8,2,78,0
Malai superior Castello,360,8,1,80,0
Malai superior din porumb degerminat No. 1 Carrefour,361,7,1,81,0
Malai superior Titan,328,9,0.5,72,0
Mei fiert,119,3.5,1,23.7,1.3
Mei uscat,378,11,4.2,72.9,8.5
Mini penne rigate piccolini Barilla,355,12.7,2,69.3,4.5
Mix de cereale Basis Müsli Naturgut,361,12.4,6.8,56.8,9.6
"Muesli bio cu ciocolata 70%, cu alune si cocos Montignac",401,9.9,16.7,52.8,12.7
Muesli capsuni Goody Vitelle,369,11.1,2.9,69.2,10.8
Muesli Cranberries Sano Vita,354,7.5,1.8,72.5,6
Muesli crunchy ciocolata-banana Goody Vitelle,415,8.8,10.3,67.9,7.7
Muesli crunchy cu ciocolata Stilla Natura,470,9.6,18.6,63,6
Musli 40% fructe Stilla,371,8.2,4,74.6,0
Musli 40% Fruit Stilla Natura,371,8.2,4,74.6,7
Musli Beeren Real Bio,320,9.4,4.9,59.5,10.1
Musli bio cu cacao Solaris Granovit,361,11.2,4,7.1,9.2
Musli cereale integrale cu stafide si alune Knusperone,368,10.8,9.3,54.9,10.8
Musli cereale integrale cu stafide si migdale Granola,392,11,12,60,10
Musli crocant cu capsuni si mere Vie Sant,334,6.2,4.1,68.7,0
Musli crocant cu ciocolata si alune Bioking,483,8.4,26.9,48.5,0
Musli crocant cu mere si scortisoara Bioking,433,7.6,13.4,68.8,0
Musli crocant cu miere Vitalis,427,7.8,14,68,6.1
Musli crocant cu stafide si grau incoltit Vitalis Dr. Oetker,426,9.9,15.4,62.1,7.2
Musli crocant cu zmeura Bioking,440,7,20.4,55.5,0
Musli Crunch mure si zmeura SanoVita,432,8.5,12.6,64,0
Musli Crunchy Stilla Natura,455,7.3,15.1,72.2,0
Musli cu 10 fructe diferite SanoVita ,332,9.6,4,68.2,0
Musli cu 30% fructe Master Crumble ,334,10,6.4,59.2,9.2
Musli cu 40% fructe cu 10 vitamine SchneeKoppe Kaufland,319,8.2,4.3,61.3,9.7
Musli cu 40% fructe Distins,317,7.8,4.6,61.1,9.2
Musli cu 40% fructe Vitalis,317,7.8,4.6,61.1,9.8
Musli cu 50% fructe Alnatura,329,8.5,4.1,64.6,19
Musli cu alune Morning Sun,346,10.7,9.3,54.8,11
Musli cu alune Sanovita,413,8.7,11.5,68.7,1.6
Musli cu amestec de nuci Vitalis Plus,475,10.2,23.3,56.1,6.9
Musli cu capsuni Crunchy Stilla Natura,463,8.4,15,73.3,0
Musli cu cereale germinate Granovit,350,10.5,3.1,63.5,8.5
Musli cu cereale integrale 32% fructe Knusperone,343,9,5.4,59.6,10
Musli cu cereale integrale Knusperone,343,9,5.4,59.6,10
Musli cu cereale integrale si seminte Bio Real,335,12.4,7.7,54.1,12.9
Musli cu ciocolata Vitalis,400,9.8,12.6,62,7.5
Musli cu fibre Sanovita,384,6.3,7.7,66.3,15.5
Musli cu fructe 365,335,9.7,4.8,63.5,6.5
Musli cu fructe Distins,332,9.6,4,68.2,0
Musli cu fructe FineFood,342,10.3,3.5,73.1,11.5
Musli cu fructe Goody Crunchy,440,6.1,16,64,0
Musli cu fructe si  nuci 365 Delhaize Mega Image,358,9.7,4.4,67.4,4.9
Musli cu fructe Winny,330,9.5,3.8,68.5,9.7
Musli cu fulgi de ciocolata si alune Distins,346,9.6,4,68.2,9.2
Musli cu goji SanoVita,383,12.6,6.4,64.8,5.5
Musli cu iaurt Joghurt Musli Master Crumble Lidl,380,11.8,7.8,61.5,8.2
Musli cu mar si scortisoara Nestle,344,9.7,3.6,68.2,8
Musli cu mar si scortisoara Rommac,365,7.2,7.1,68,6.7
Musli cu stafide si alune Stilla,403.8,11.2,9,69,0
Musli cu stafide si aluneStilla Natura,388,11,9,62,7
"Musli cu stafide, alune, nuci Stilla Natura",350,10.8,4.6,71.5,10.3
Musli din cereale cu fulgi de ciocolata amaruie 20% Master Crumble,420,9.9,12.5,63.4,0
Musli din cereale intergrale cu stafide si nuci Master Crumble Lidl,368,10.8,9.3,54.9,10.8
Musli Dynamic Vitalis Dr. Oetker,356,11.3,7.2,61.4,7.6
Musli Fit & Active Vollkorn,331,9.8,5.7,60,10
Musli fructe de padure Sanovita,387,9.6,5.4,70.8,4.5
Musli fructe Granola,346,8.9,5.6,65,8.8
Musli Goody Breakfast,350,11.5,6.4,61.7,0
Musli instant cu fructe Sanovita,324,7.9,6.8,72.4,0.5
Musli Morning Sun,321,8.9,5,60.2,9.8
Musli Nestle,414,9.7,9.6,68.1,8.3
Naut Pirifan,378,6.5,1.8,74.1,15.2
Naut uscat Deroni,164,8.9,2.6,27.4,7.6
Orez 3 culori Auchan,345,7.5,0.7,76,2.5
Orez alb negatit,365,7,1,80,1
Orez Atifco,361,6,0.8,82,0.6
Orez Basmati negatit,347,8,0,76,12
Orez basmati of India Noe,351,7,1.2,76.7,1.2
Orez basmati si salbatic Panzani,358,9.1,1.1,78,0
Orez Basmati Uncle Ben's,351,9,1.1,76,0.6
Orez Bio Nature,382,7.6,2.4,81,3.1
Orez bob lung Atifco,340,7,0.5,78.4,2.5
Orez bob lung Uncle Ben's,344,7.7,0.4,77,1.4
Orez bob rotund Eisler,344,7,0.9,77,0
Orez brun integral Gran Nero Riso Scotti,325,9.9,3.4,63.7,8.5
Orez brun integral Riso Scotti,360,7.9,2.6,76.3,4.3
Orez brun prefiert Panzani,350,8,2.9,73,1
Orez brun prefiert Panzani gatit,141.8,2.9,2.9,26.1,1
Orez brun Sanovita,349,7.3,2.8,71.2,3.3
Orez Camolino Atifco Foods,343,6.6,1.2,77.5,2
Orez Carosio,354,6.7,1.5,78.5,0
Orez cu bob foarte mare Colosal Scotti,359,6.8,1.4,79.8,1.2
Orez cu bob lung negatit,370,7.9,2.9,77.2,3.5
Orez cu bob lung Panzani Express,351.2,7,0.5,76.5,0
Orez cu bob lung Scotti,347,6.7,0.6,78.8,0
Orez cu bob mare Panzani,345,7,0.9,78,0.4
Orez cu bob mare Scotti,334,6.8,0.7,77.5,0
Orez cu bob rotund Aro,342,7.3,0.2,78.4,4.3
Orez cu bob rotund Deroni,343,6.8,1.3,76.1,0.7
Orez cu bob rotund Scotti,355,6.4,0.9,80.5,0
Orez Deroni,351,7,1,78,1
Orez Deroni Extra,336,8.1,1.2,73.3,0.7
Orez expandat bio Irma,390,7,4,81,0
Orez expandat Riso Scotti,381,8.3,3.1,79.9,4.1
Orez expandat Roppo,365,7,1.8,78,0
Orez fiert,130,2.7,0.3,28.2,0.4
Orez instant Riso Scotti,152,3.1,3.9,26,1.6
Orez integral Carrefour,360,7.9,2.6,76.3,4.3
Orez integral Delhaize,337,7.5,2.4,71.5,6
Orez integral Riso Scotti Selection,344,7.6,3.1,68.6,5.7
Orez integral Sannia,342,7.8,2,70.8,4.8
Orez integral Solaris,370,7.9,2.9,77.2,3.5
Orez integral Uncle Ben's,344,8,2.2,73,3.2
Orez lung prefiert Scotti,353,6.9,0.7,78.8,0
Orez lung prefiert Uncle Ben's,430,8.3,1.6,95,1.2
Orez mexican Scotti,163,3.1,5.5,25.3,2.3
Orez natur Express Panzani,358.7,7.7,2.4,74.7,2
Orez natural brun Konpack,353,7.1,1.9,76.8,4
Orez nefiert Risotto,380,8,0.3,84,0
Orez negru,320,10,3,68,4
Orez pentru pilaf Deroni,334,6.8,1.2,74.1,0.5
Orez prefiert Atifco,344,5.5,0.9,80.1,3.2
Orez prefiert cu bob lung Panzani Premium,347,7,0.6,78,0
Orez prefiert Deroni Vital,353,7.2,1,78.5,0.6
Orez prefiert Sunshine,357,7.5,0.7,80.2,1
Orez Risotto selection Scotti,351,6.9,1.3,77,1.9
Orez rosu Krina,362,7.5,2.7,76.2,3.4
Orez salbatic Scotti,358,8.4,1.2,78.5,0
Orez Scotti Arlecchino,350,8.8,3,70,4.1
